[
  {
    "title": "光の粒子",
    "size": "A4",
    "price": 680,
    "edition": "限量 50",
    "paperType": "Hahnemühle Photo Rag",
    "photo": "web_001.jpeg",
    "public": true
  },
  {
    "title": "街の断片",
    "size": "A3",
    "price": 1200,
    "edition": "限量 30",
    "paperType": "Hahnemühle Photo Rag",
    "photo": "web_003.jpeg",
    "public": true
  },
  {
    "title": "午後の静寂",
    "size": "A4",
    "price": 680,
    "edition": "限量 50",
    "paperType": "Canson Infinity",
    "photo": "web_002.jpeg",
    "public": true
  },
  {
    "title": "俯瞰",
    "size": "A2",
    "price": 2400,
    "edition": "限量 15",
    "paperType": "Hahnemühle Photo Rag",
    "photo": "web_004.jpeg",
    "public": true
  },
  {
    "title": "都市の影",
    "size": "A4",
    "price": 680,
    "edition": "限量 50",
    "paperType": "Canson Infinity",
    "photo": "web_007.jpeg",
    "public": true
  },
  {
    "title": "东京の隙間",
    "size": "A3",
    "price": 1200,
    "edition": "限量 30",
    "paperType": "Hahnemühle Photo Rag",
    "photo": "web_023.jpeg",
    "public": true
  }
]